<?xml version="1.0" encoding="UTF-8"?>

<spontaneous id="789" datetime="2010-03-01T11:42:00" xmlns:xsi="http://www.w3.org/2001/XMLSchema-instance" xsi:schemaLocation="http://www.bbn.com/Translations C:\project\Speech\translations.xsd">
	<translations>
		<translation id="789.1">
			<source> word1 word2 wordnےندرھے </source>
			<targets>
				<target> word1 word2 wordnےندرھے </target>
				<target> word1 word2 wordn </target>
				<target> word1 word2 wordn </target>
				<target> word1 word2 wordn </target>
			</targets>
		</translation>
		<translation id="789.2">
			<source> word1 word2 wordn </source>
			<targets>
				<target> word1 word2 wordn </target>
				<target> word1 word2 wordn </target>
				<target> word1 word2 wordn </target>
			</targets>
		</translation>
	</translations>
</spontaneous>
